{
  "title": "5 Best Free Daily Planner Apps for 2023 (Features, Price)",
  "authors": [
    "Jackie Peng"
  ],
  "tags": [
    "Content"
  ],
  "description": "In this article, we‚Äôll highlight the 5 best free Daily Planner apps with features available today that help you plan, prioritize, and streamline your day, so you can conquer the chaos and focus on what matters most.",
  "created": 1679011200000,
  "updated": null,
  "layout": "blog",
  "id": "oapgNIuMNG",
  "slug": "5-best-free-daily-planner-apps-for-2023",
  "cover": "https://app.affine.pro/api/workspace/H6vffRmJbCfA-r3kq_36_/blob/Ip3I2WQQll2Mb0C8Dax12YbtDS5t9oF0BTpV4jHQOHo=.webp",
  "md": "---\n\ntitle: \"5 Best Free Daily Planner Apps for 2023 (Features, Price)\"\n\nauthor: Jackie Peng\n\ntags: Content\n\nslug: 5-best-free-daily-planner-apps-for-2023\n\ndescription: In this article, we‚Äôll highlight the 5 best free Daily Planner apps with features available today that help you plan, prioritize, and streamline your day, so you can conquer the chaos and focus on what matters most.\n\ncreated: 2023-03-17\n\nupdated: 2023-07108-23\n\nlayout: blog\n\npublish: true\n\n---\n\n\n![Ip3I2WQQll2Mb0C8Dax12YbtDS5t9oF0BTpV4jHQOHo=](https://app.affine.pro/api/workspace/H6vffRmJbCfA-r3kq_36_/blob/Ip3I2WQQll2Mb0C8Dax12YbtDS5t9oF0BTpV4jHQOHo=)\n\nImagine this:\n\nYou‚Äôre sitting in your office, or maybe at your kitchen table, sipping coffee and trying to plan your day. You have a meeting in an hour, a project deadline looming, and an ever-growing list of errands to run. As you frantically scribble notes and reminders on sticky notes and random scraps of paper, you can‚Äôt help but feel like there must be a better way to stay on top of it all.\n\nEnter daily planner apps‚Äî these digital lifesavers help you plan, prioritize, and streamline your day, so you can conquer the chaos and focus on what matters most.\n\nIn this article, we‚Äôll discuss the importance of daily planner appsand highlight the 5 best free options with features available today.\n\nLet‚Äôs begin.üìñ ‚úçÔ∏è\n\n# What is the definition of Daily Planner apps?\n\nA daily planner app is a software or app specifically designed to help you organize, schedule, and prioritize tasks, appointments, and other daily activities. These apps typically offer a wide range of features, such as task lists, calendars, reminders, time tracking, and goal setting, to keep you focused and on track. To be considered a top daily planner app, it must meet the following criteria:\n\n* Free and open-source: Allows for accessibility and customization even if you don‚Äôt have much of money.\n* Enhances productivity: Streamlines task management and helps you get more done in less time.\n* Keeps things organized: Provides a clear and structured interface to manage tasks, events, and ideas.\n* User-friendly: Intuitive design and ease of use, catering to users of varying technical expertise.\n* Robust feature set: Offers a comprehensive suite of apps and functionalities to address a wide range of planning and organizing needs.\n# 5 Best Daily Planner apps For 2023\n\n## 1. AFFiNE\n\n\n![nXRhm5YLReyxFoU1jll7CMHIoEzbzvxI1dezaSWojTU=](https://app.affine.pro/api/workspace/H6vffRmJbCfA-r3kq_36_/blob/nXRhm5YLReyxFoU1jll7CMHIoEzbzvxI1dezaSWojTU=)\n\n[AFFiNE](http://affine.pro) is an innovative and comprehensive daily planner app designed to help you organize, manage, and collaborate on tasks, projects, and information. As a next-generation knowledge base, AFFiNE combines the best features of popular apps like Notion and Miro into one powerful, flexible, and user-friendly platform. It focuses on data security, privacy, and collaboration, making it the perfect choice for managing your daily plans, personal knowledge repository, and team projects.\n\n\n![Lz45Jab9urCCzj1WZxhs0fI6UAtPN7IPp4kQ43jXjk0=](https://app.affine.pro/api/workspace/H6vffRmJbCfA-r3kq_36_/blob/Lz45Jab9urCCzj1WZxhs0fI6UAtPN7IPp4kQ43jXjk0=)\n\nWhat you can do with AFFiNE‚Äôs key features:\n\n1. Local-first design: AFFiNE prioritizes data security and privacy, ensuring your data remains stored on your local device unless you actively delete it.\n1. Multiple workspaces: Create different workspaces to manage various types of data, like managing your daily tasks, personal knowledge repository, and team projects simultaneously.\n1. Pages within workspaces: Organize your tasks, notes, and ideas in different pages within each workspace, making it easy to navigate and find what you need.\n1. Powerful search functionality: Quickly locate the documents, tags, or actions you want with a modern search app that can handle multiple workspaces and pages.\n1. Advanced collaboration capabilities: Invite friends or colleagues to become collaborators in your workspace, engage in real-time multi-person editing, and share your workspaces with others.\n1. Time tracking and goal setting: Use AFFiNE‚Äôs built-in features to track your time spent on tasks and set goals to improve your productivity.\n1. Open-source: As an open-source app, you can access AFFiNE‚Äôs code, allowing for customization and the ability to deploy the server on your own computer or data center.\nHere are some quick view of what you can do with AFFiNE core features:\n\n* **Database**\n  * Easily create, organize, and track your daily note like never before. Say goodbye to complex processes and welcome an unprecedented ease-of-use way\n\n![s1-kYhapEsBPNhy4eDA2SnXKwB_ws6Ke7dGXUqpMjDo=](https://app.affine.pro/api/workspace/H6vffRmJbCfA-r3kq_36_/blob/s1-kYhapEsBPNhy4eDA2SnXKwB_ws6Ke7dGXUqpMjDo=)\n\n* Powerful Edgeless mode\n  * Visualize and connect your daily ideas smoothly with better cartoon-style shape, slick pen, and connectors. No constraints. Limited only by your imagination. Ohhh, by the way, images now are supported to upload!! We just make everything easy for you, now you may enjoy your drawing time!\n  \n![6ANoWk9Wn5mf2IsgS-yy-MRN-cf1iRf4VZfF9ihUAgs=](https://app.affine.pro/api/workspace/H6vffRmJbCfA-r3kq_36_/blob/6ANoWk9Wn5mf2IsgS-yy-MRN-cf1iRf4VZfF9ihUAgs=)\n\n* **Notion/html/markdown import-supported**\n  * Effortlessly import Notion, HTML, or Markdown content into AFFiNE with just a few simple clicks, preserving formatting, and structure, and saving time, enhancing user experience. Say goodbye to the complicated process of manually converting and adjusting content.\n\n\n  \n![Funez4FG6_YYPlgBYoKy3M7F2NJLCtwrE7NplHuuB4Q=](https://app.affine.pro/api/workspace/H6vffRmJbCfA-r3kq_36_/blob/Funez4FG6_YYPlgBYoKy3M7F2NJLCtwrE7NplHuuB4Q=)\n\n* **Tags- Enhance Content Organization and Discoverability**\n  * Assign descriptive tags to your content, enabling effortless categorization and quick access to relevant information whenever needed.\n  \n![CgxJfxH0NgPs6vyUnGLDNyJXoZf9DNl8NYJwo5TZ25I=](https://app.affine.pro/api/workspace/H6vffRmJbCfA-r3kq_36_/blob/CgxJfxH0NgPs6vyUnGLDNyJXoZf9DNl8NYJwo5TZ25I=)\n\n* **Collections - Unleash the Power of Smart Collections**\n  * A few steps to set criteria, collect filtered pages, and effortlessly curate frequently used content, ensuring efficient organization and easy retrieval and comprehensive management.\n  \n![lWmboopIBpGPXguszJKPus_9hg3AgCrQUUmJARNPtJQ=](https://app.affine.pro/api/workspace/H6vffRmJbCfA-r3kq_36_/blob/lWmboopIBpGPXguszJKPus_9hg3AgCrQUUmJARNPtJQ=)\n\n  * Effortlessly navigate through your notes by seamlessly linking related pages, ensuring a smooth and convenient experience.\n\n![0ZvMGNB3m1GojJ4VU21vNjIAwc9PAg-TsXR1dTJQDcg=](https://app.affine.pro/api/workspace/H6vffRmJbCfA-r3kq_36_/blob/0ZvMGNB3m1GojJ4VU21vNjIAwc9PAg-TsXR1dTJQDcg=)\n\n**AFFiNE‚Äôs Price:**\n\nIn addition to those mentioned above, AFFiNE is a fantastic, completely free daily planner app that welcomes everyone to experience its powerful features, making it a delightful surprise for those seeking a comprehensive solution for their daily planning needs.\n\n* Come and check with our latest [Stable version](https://affine.pro/download), enjoy your creative moments.\n* For more things related to AFFiNE, Come and check out our website:&nbsp;[AFFiNE ‚Äî All In One KnowledgeOS](https://affine.pro/)\n* Wanna try it online:[https://app.affine.pro/](https://app.affine.pro/)\n## 2. Clickup\n\n\n![b70Gt0FlogAH6EnUHu_95PmZiiCV6bdDl02r9OnNDl4=](https://app.affine.pro/api/workspace/H6vffRmJbCfA-r3kq_36_/blob/b70Gt0FlogAH6EnUHu_95PmZiiCV6bdDl02r9OnNDl4=)\n\nClickUp is an outstanding productivity app and one of the top online planners designed for individuals and teams of all sizes to manage their to-do lists effectively.\n\nRegardless of your role ‚Äî be it a task manager, a student handling assignments, or a parent putting together a grocery list ‚Äî ClickUp has the potential to be your ideal weekly planner app.\n\nHere‚Äôs a quick look into some useful Clickup features:\n\n1. Task Management: Create tasks, subtasks, and checklists to break down your daily plan into manageable steps. You can easily set priorities, due dates, and assign tasks to team members.\n1. Customizable Views: Choose from various views like list, board, calendar, and Gantt chart to visualize your daily plan in a way that suits your workflow best.\n1. Time Tracking: Use the built-in time tracking feature to monitor the time spent on tasks, helping you stay on track with your daily plan and improve productivity.\n1. Reminders and Notifications: Set reminders for important tasks and receive notifications about upcoming deadlines, ensuring you stay on top of your daily plan.\n1. Goal Setting: Define and track your goals in ClickUp, which helps you stay focused on the objectives that matter most in your daily plan.\nClickup Price:\n\nClickUp has a¬†**Free Plan,**¬†but it won‚Äôt cover all the funtionalities you need most, $5/user per month is necessary if there‚Äôs more you wanna do with clickup\n\nKnowing more about AFFiNE or Clickup, which one is most suitable to you, can check this article:¬†[https://affine.pro/blog/seven-best-open-source-clickup-alternatives-2023](https://affine.pro/blog/seven-best-open-source-clickup-alternatives-2023)\n\n## 3.Notion\n\n\n![P_a2i4g2vgHb2cRUrkCJpruNZVJQfYSSOv4HkmcVaKU=](https://app.affine.pro/api/workspace/H6vffRmJbCfA-r3kq_36_/blob/P_a2i4g2vgHb2cRUrkCJpruNZVJQfYSSOv4HkmcVaKU=)\n\nNotion is a versatile all-in-one workspace application designed to help users with note-taking, project management, and task organization. It has gained significant popularity among professionals and teams across various industries. As an excellent app for managing daily work plans, Notion‚Äôs flexibility and wide range of features cater to users with diverse requirements, making it a go-to choice for many.\n\n1. Tasks and to-do lists: Create tasks and to-do lists to track and manage your daily responsibilities.\n1. Project boards: Use Kanban-style project boards to visualize your daily work plan and monitor progress.\n1. Calendar view: Plan and schedule your tasks in a calendar view, making it easy to see what‚Äôs coming up in your daily work plan.\n1. Databases: Create and manage databases to store and organize information related to your daily tasks and projects.\n1. Templates: Use templates to quickly set up pages or databases for recurring tasks or projects, saving time in your daily planning.\nNotion price:\n\nNotion‚Äôs free plan still provides a comprehensive set of features for individual users and small teams. However, for those who need more advanced capabilities, collaboration options, and support, upgrading to a paid plan might be necessary.\n\nKnowing more about AFFiNE or Notion, which one is most suitable to you, can check this article:¬†[5 Best Open Source Alternatives to Notion (affine.pro)](https://affine.pro/blog/best-open-source-notion-alternatives)\n\n## 4.Trello\n\n\n![wv0wkqJD-zn10JH1_ADAGHwYccWEz7mtzTj5tAdBAN0=](https://app.affine.pro/api/workspace/H6vffRmJbCfA-r3kq_36_/blob/wv0wkqJD-zn10JH1_ADAGHwYccWEz7mtzTj5tAdBAN0=)\n\nTrello is a popular visual project management app that uses boards, lists, and cards to help you organize your daily tasks. With its simple, drag-and-drop interface, Trello is easy to use and offers a variety of integrations with other productivity apps.\n\n1. create boards for projects or categories, lists for stages or tasks, and cards for individual tasks or subtasks, making it easy to organize and prioritize your daily work plan.\n1. Drag-and-drop Interface: Trello‚Äôs intuitive drag-and-drop interface allows you to quickly move tasks between different stages or lists, making it simple to update your daily work plan as priorities change.\n1. Due Dates and Reminders: Assign due dates to cards and receive reminders before the deadlines, ensuring that you stay on track with your daily work plan.\nTrello price:\n\nTrello also offers the¬†**Free Plan,**¬†but there are some limitations that might affect its usability for certain users or more complex projects. So you still need to pay extra $10 to have more useful features.\n\n* Wanna read more comparison articles related to Trello, check this:¬†[6 Best Project Management Tools to boost productivity in 2023 (affine.pro)](https://affine.pro/blog/best-project-management-tools-2023)\n## 5.Todoist\n\n\n![To7hLoepQGZ0P0udBe8CBFlT0uxGI1_Hrqr_4o9Rt8Y=](https://app.affine.pro/api/workspace/H6vffRmJbCfA-r3kq_36_/blob/To7hLoepQGZ0P0udBe8CBFlT0uxGI1_Hrqr_4o9Rt8Y=)\n\nTodoist is a popular to-do list and task management app that helps you organize and prioritize your daily tasks. With its clean and user-friendly interface, Todoist offers features like due dates, recurring tasks, and reminders to help you stay on top of your daily plan.\n\n1. Task creation: Easily create tasks with deadlines, labels, and priorities to stay organized and focused on what matters most.\n1. Project organization: Organize tasks into projects and sections to visualize and manage your daily work plan more effectively.\n1. Recurring tasks: Set up tasks that repeat daily, weekly, monthly, or with a custom frequency to help you manage your routine activities.\nTodoist price:\n\nTodoist offers various pricing plans to cater to different users‚Äô needs. These include a Free plan, a Premium plan, and a Business plan. However, the free plan doesn‚Äôt include reminders, which can be crucial for staying on track with daily tasks and deadlines.\n\n# Which Daily Planner App offers the best solution?\n\nWhile each of the daily planner apps discussed offers its own unique and appealing features, we encourage users to choose the ideal option based on their specific needs and pain points. However, with a humble perspective, we still propose that AFFiNE emerges as the ultimate winner in this evaluation, providing a comprehensive and versatile solution for managing daily tasks and goals, catering to a wide range of user requirements.\n\n\n---\n\nAFFiNE is still in its beta, but we are continuing to build to a more feature-rich and stable build. Come and join us on our journey over on our media platforms.\n\n* Official Website:¬†[https://affine.pro/](https://affine.pro/)\n* GitHub:¬†[https://github.com/toeverything/AFFiNE](https://github.com/toeverything/AFFiNE)\n* Discord:¬†[https://discord.gg/Arn7TqJBvG](https://discord.gg/Arn7TqJBvG)\n* Telegram:¬†[https://t.me/affineworkos](https://t.me/affineworkos)\n\n\n## Support Us: Become an Early Access Sponsor to try out AFFiNE Cloud starting from September!\n\n\n![flDBAikMzQhG8jKLpZtfJH2pOuwCSeLvU8kuuh0bGpw=](https://app.affine.pro/api/workspace/H6vffRmJbCfA-r3kq_36_/blob/flDBAikMzQhG8jKLpZtfJH2pOuwCSeLvU8kuuh0bGpw=)\n\nJoin us as an early access sponsor for the AFFiNE Cloud, and unlock advanced collaboration capabilities while upholding the local-first nature of your data. As a token of our appreciation, you'll enjoy:\n\n* **Early Access,** be among the first to experience AFFiNE Cloud's powerful features, including permission settings and control.\n* **One-year Free Pro Plan,** have a complimentary one-year premium AFFiNE Pro Plan subscription, packed with advanced tools to boost your productivity and creativity.\n* **Lifetime 50% Discount on Pro Plan**, benefit from a lasting 50% discount as long as you continue to find value in your subscription.\n* **Other details:**\n  * AFFiNE Cloud enhances collaboration without compromising your data's local-first\n  * The free plan will remain available and always an option, with ongoing improvements.\n* More details: [https://affine.pro/blog/affine-cloud-early-access](https://affine.pro/blog/affine-cloud-early-access)\n",
  "publish": true
}